{
  "genoa_version": "1.0.0",
  "image": {
    "id": "sha256:a1b2c3d4e5f6a1b2c3d4e5f6a1b2c3d4e5f6a1b2c3d4e5f6a1b2c3d4e5f6a1b2",
    "name": "smolbsd-agent-host",
    "version": "0.1.0",
    "os": "freebsd",
    "architecture": "amd64"
  },
  "agent_runtime": {
    "type": "mcp-server",
    "endpoint": "http://localhost:8080",
    "protocol_versions": ["2025-11-05"],
    "auth": {
      "type": "none"
    },
    "status": "running"
  },
  "catalog_url": "https://genoa.dev/v1/catalog.json",
  "manifest_url": "http://localhost/.well-known/genoa-manifest.json",
  "attestation_url": "http://localhost/.well-known/genoa-attestation.json",
  "capabilities_url": "http://localhost:8080/v1/tools/list",
  "conformance": {
    "level": "L2",
    "probe_url": "https://genoa.dev/v1/conformance/probe.nu",
    "last_verified": "2026-04-30T12:00:00Z"
  },
  "links": {
    "self": "http://localhost/.well-known/genoa.json",
    "schema": "https://genoa.dev/v1/schemas/discovery.v1.json",
    "catalog": "https://genoa.dev/v1/catalog.json",
    "spec": "https://genoa.dev/v1/spec/genoa-v1.md"
  }
}
